{
  "task_id": "tvs-20260128-001",
  "status": "PASS",
  "judges": [
    {
      "id": "judge_a",
      "status": "PASS",
      "reason": "gate_report must PASS"
    },
    {
      "id": "judge_b",
      "status": "PASS",
      "reason": "check name must be OK"
    }
  ],
  "created_at": "2026-01-28T14:49:03.021335+00:00"
}